{
  "schema_version": "1.0",
  "request_id": "aggregation-request-001",
  "mission_id": "mission-001",
  "plan_version": 2,
  "context_version": 5,
  "requested_at": "2026-09-28T02:00:00Z",
  "scenario_context": {
    "scenario_id": "EPCE-EXPANDED-01",
    "map_id": "EPCE-EXPANDED",
    "map_reference_position": {"latitude": 54.42, "longitude": 17.78, "altitude_m": 149, "altitude_reference": "MSL"},
    "weather_version": 1,
    "constraint_version": 1
  },
  "tasks": [
    {
      "task_id": "observe-b-visible", "task_type": "OBSERVE", "target_area_id": "AREA-B",
      "target_position": {"latitude": 54.44, "longitude": 17.835, "altitude_m": 750, "altitude_reference": "MSL"},
      "duration_sec": 60, "priority": 2, "time_window": {"start_sec": null, "end_sec": null},
      "required_payload_ids": ["payload.stormcaster_e"], "required_capabilities": ["LOITER", "EO_DAYLIGHT"],
      "depends_on": [], "merge_policy": "BUNDLE_IF_COMPATIBLE",
      "constraints": {"min_altitude_m": 500, "max_altitude_m": 1000}
    },
    {
      "task_id": "observe-c-infrared", "task_type": "OBSERVE", "target_area_id": "AREA-C",
      "target_position": {"latitude": 54.455, "longitude": 17.9, "altitude_m": 800, "altitude_reference": "MSL"},
      "duration_sec": 90, "priority": 2, "time_window": {"start_sec": null, "end_sec": null},
      "required_payload_ids": ["payload.wescam_mx15"], "required_capabilities": ["LOITER", "IR_THERMAL"],
      "depends_on": [], "merge_policy": "BUNDLE_IF_COMPATIBLE", "constraints": {"min_altitude_m": 500, "max_altitude_m": 1000}
    },
    {
      "task_id": "search-d-radar", "task_type": "SEARCH", "target_area_id": "AREA-D",
      "target_position": {"latitude": 54.47, "longitude": 17.95, "altitude_m": 1000, "altitude_reference": "MSL"},
      "duration_sec": 120, "priority": 2, "time_window": {"start_sec": null, "end_sec": null},
      "required_payload_ids": ["payload.lynx_mmr"], "required_capabilities": ["RADAR"],
      "depends_on": [], "merge_policy": "BUNDLE_IF_COMPATIBLE", "constraints": {"min_altitude_m": 600, "max_altitude_m": 1200}
    }
  ],
  "fleet_snapshot": {
    "fleet_snapshot_version": 11,
    "aircraft": [
      {
        "aircraft_id": "C172-01", "model_id": "C172", "xplane_instance_id": null, "available": true,
        "position": {"latitude": 54.42, "longitude": 17.78, "altitude_m": 149, "altitude_reference": "MSL"},
        "installed_payload_ids": ["payload.stormcaster_e"], "available_payload_ids": ["payload.stormcaster_e"],
        "flight_capabilities": ["NAVIGATION", "LOITER"], "remaining_endurance_sec": 10800,
        "aircraft_profile": {"cruise_speed_mps": 55, "service_ceiling_m": 4267, "max_work_sec": 10800}
      },
      {
        "aircraft_id": "C172-02", "model_id": "C172", "xplane_instance_id": null, "available": true,
        "position": {"latitude": 54.42, "longitude": 17.78, "altitude_m": 149, "altitude_reference": "MSL"},
        "installed_payload_ids": ["payload.wescam_mx15"], "available_payload_ids": ["payload.wescam_mx15"],
        "flight_capabilities": ["NAVIGATION", "LOITER"], "remaining_endurance_sec": 10800,
        "aircraft_profile": {"cruise_speed_mps": 55, "service_ceiling_m": 4267, "max_work_sec": 10800}
      },
      {
        "aircraft_id": "SF50-01", "model_id": "SF50", "xplane_instance_id": "XPLANE-03", "available": true,
        "position": {"latitude": 54.42, "longitude": 17.78, "altitude_m": 149, "altitude_reference": "MSL"},
        "installed_payload_ids": ["payload.lynx_mmr"], "available_payload_ids": ["payload.lynx_mmr"],
        "flight_capabilities": ["NAVIGATION", "LOITER"], "remaining_endurance_sec": 10800,
        "aircraft_profile": {"cruise_speed_mps": 150, "service_ceiling_m": 8534, "max_work_sec": 10800}
      }
    ]
  },
  "completed_task_ids": [],
  "parameters": {"aggregation_threshold": 0.55, "max_bundle_distance_m": 10000,
                 "max_tasks_per_group": 4, "solver_time_limit_sec": 10,
                 "endurance_reserve_ratio": 0.2}
}
